,text,label
2448,"I got some cash at an ATM earlier, but now app is showing that I withdrew more than I did.  Help!",75
2449,Cash withdrawal was incorrect at ATM.,75
2450,"I withdrew money from an ATM today, and now my account is showing a different amount than what I withdrew. I checked the amount the ATM gave me, and it looks like it gave me the wrong amount of money. What is the best thin for me to do to get this fixed?",75
2451,Why did the ATM give me less money than what I requested?,75
2452,I did not receive the right amount of cash.,75
2453,How can we correct a mistake on an ATM transaction?  The app shows what I should have gotten.,75
2454,Why did I not get the amount I specified at the ATM?,75
2455,The ATM didn't give me what I asked for but my balance says it did,75
2456,I got less cash than what I specified for through the ATM.,75
2457,What happened! I asked for 30 pounds at your ATM and only go 10. The machine lied about it too. It said I received the full 30 pounds. Someone better help me asap on this.,75
2458,A wrong amount of cash we sent to me.,75
2459,"I took out money, and didn't get all of it.",75
2460,How can I get cash back? The ATM just gave me the wrong amount that I've been actually charged though...,75
2461,"Please help me with the amount that i have withdrawn from the ATM today, the ATM has given me wrong sum of amount, and i could see that the app is displaying the greater amount than taken out.",75
2462,I withdrew $100 but only received $20,75
2463,I requested money from the ATM and it didn't give me as much as I requested.,75
2464,"Hey I am standing in front of an ATM here, it only gave me 10 pounds even though I wanted to withdraw 30! Seems like the app has 30 pounds, what do I do??",75
2465,$20 came out instead of $100,75
2466,How can I fix this? The ATM gave me more cash than I'd asked for.,75
2467,I could not get the cash I wanted,75
2468,I wanted to take out $100 but I only got $20.,75
2469,"Help, the ATM didn't give me all the money I requested",75
2470,The cash I asked for still hasn't been received,75
2471,I wanted $100 but only got $20,75
2472,The ATM didn't give me the amount I asked for,75
2473,Where'd the rest of my cash go from the ATM,75
2474,I got less cash at the ATM than I asked for. Why?,75
2475,There was a limited amount of money available at the time of my transaction.,75
2476,My cash withdrawal was not entirely complete,75
2477,The atm didn'y give me all the cash,75
2478,The ATM is messed up. It gave me less than I wanted.,75
2479,I received the wrong amount of cash from the ATM. Can you help?,75
2480,ATM only gave me $20 instead of $100,75
2481,I was only given $20 when I tried to get $100,75
2482,I needed $100 but all it gave me was $20.,75
2483,I tried pulling out money at the ATM and it gave me an incorrect amount back.,75
2484,Why did I only get $20 when I asked for $100?,75
2485,The amount of cash i have received is not correct.,75
2486,How can I get my money that I didn't get from the ATM?,75
2487,"Hi, Today i have withdrawn cash from ATM but i got wrong amount and in the app it is showing much more amount than that.",75
2488,I didn't get all the money I asked for,75
2489,The ATM did not give me as much cash as I requested.,75
2490,How can I request cash back? The ATM just gave me a different amount than what I've been actually charged though...,75
2491,Why is my withdrawal wrong? I took out $100 but only received $20.,75
2492,I asked for cash but I did not receive all the funds,75
2493,The ATM I'm standing in front of only gave me 10 pounds rather than the 30 pounds I wanted. The app shows I took out 30 pounds also. What do I need to do to fix this?,75
2494,I only got some of the cash I requested from the ATM,75
2495,"I am at the ATM and tried to withdraw 30 pounds and it only gave me 10 pounds, what do I do?",75
2496,I got the incorrect amount of money given to me from my account,75
2497,I did not receive the correct amount of cash.,75
2498,I did not receive all of my cash back,75
2499,I got some cash but it wasn't the right amount.,75
2500,Can you explain why the ATM is giving me less money than what I asked for?,75
2501,I tried to withdraw 50 pounds but it only gave me 30. Where is the rest of my money?,75
2502,I visited the ATM but got less money than what I requested. Why?,75
2503,I couldn't get the money I needed.,75
2504,Who should I contact if the amount of my withdrawal doesn't correspond to the amount that I tried to take out of my account?,75
2505,I made an ATM withdraw it didn't give me the amount I asked for but is showing a withdraw for that amount.,75
2506,So I just went to the ATM to get some cash.  I input that I needed 100 pounds but I only got 80.  I have the receipt  and I am in need of the extra money.  How do I go about obtaining the missing amount?,75
2507,The amount of money I pushed at the atm machine did not come out of the machine.,75
2508,"I got less than what i asked for in the ATM, why?",75
2509,"I'm stuck here at your broken ATM and I don't know what to do next. Asked for 30 pounds, got 10. ATM said I got 30. Something very wrong here and I want my money now!",75
2510,The machine only paid me a hundred when I wanted 20,75
2511,There was a fee charged when I paid with my card.,15
2512,I received a fee I should not have.,15
2513,Why am I being a charged for using my card?,15
2514,Tell me why there is a fee for a card payment.,15
2515,I don't understand why I'm being charged for using my card.,15
2516,I paid with my card so so why was I charged a transaction fee?,15
2517,"I shouldn't have been charged but I see a fee, why?",15
2518,"i made a payment with my card and was charged a fee, why would you do that",15
2519,A fee came along with me paying with card,15
2520,I had to pay a fee when buying items with my card.,15
2521,Why is there a fee when I thought there would be no fees?,15
2522,Why are there fees for using a card?,15
2523,I had to pay money for paying with my card.,15
2524,"I'm going on holiday to France for 6 weeks with my family and the cat, Fluffy.  I just purchased €10,000 from a currency exchange to ensure we don't run short but there appears to be a fee.  What is this for?",15
2525,What are the reasons to be charged a fee on card payments?,15
2526,I paid with card and was charged a fee that shouldn't be there!,15
2527,Why was I charged an extra fee when paying with card?,15
2528,I noticed a new fee on my account. I didn't know there were fees for these payments. What is the policy?,15
2529,I don't understand why I was charged an additional fee for this service. Can you clarify?,15
2530,Why is there a fee for using my card?,15
2531,Why was my transaction charged an extra fee when paying with my card?,15
2532,"Where can I find out the fee structure for my account? I have been charged fees for some transactions, but not for other ones. I can't find a pattern in these fees.",15
2533,"On a card payment, why is there a fee?",15
2534,Why did I get charged a fee for my card payment?,15
2535,Why are you charging me fees for using my card?,15
2536,What is the extra fee that showed up on my card?,15
2537,Why was I charged a fee for using my card,15
2538,Let me know when I get charged extra for payments. I saw on the app a fee I wasn't forewarned about.,15
2539,I was charged a fee for using my card. Can I check that in any way? It seems like there are occasions that I am charge for fees. Can you elaborate this?,15
2540,I got charged a service fee on my account. Can it be waived since I didn't know about it before?,15
2541,I think a fee was applied for paying with a card.,15
2542,I'm being charged for using my card!,15
2543,I bought something with my card and I was charged a fee,15
2544,I received an extra charge for using the card. Why?,15
2545,Can you explain why my payment was charged a fee?,15
2546,Is there a fee for paying by card?,15
2547,Who charged me a fee for paying by card?,15
2548,I have a fee showing from last time I used my card.,15
2549,Why is this fee being charged to me after using my card?,15
2550,"Why wasn't it obvious that you charge for payments? If you put the fees in an easy to read format, this could have been avoided.",15
2551,Why am I being charged fees on some transactions but not on others? What am I missing here? I cannot find where to see the fee structure on my account. Help!,15
2552,I payed with the card and there was an extra fee?,15
2553,Is it normal to be charged an extra fee when paying with my card?,15
2554,Why was there a fee for paying by card?,15
2555,How did the extra charge on my card come in effect?,15
2556,Please tell me why I was charged additionally when I used the card.,15
2557,I made a purchase with my card and I was charged a fee for using it,15
2558,I was made to pay a fee for making a transaction with card.,15
2559,"Why, when paying with the card, was I charged an extra fee?",15
2560,I have never been charged a card payment fee before. Why did this change?,15
2561,What can i pay with out  fees,15
2562,Why and I being charged this fee?,15
2563,Why was I charged a fee? I thought shopping was free?,15
2564,There was an extra charge when I used my card,15
2565,What is this fee for card payment?,15
2566,I saw a fee on my app from one of my payments and I wasn't sure where it came from. Is there a way you can tell me when there's an additional fee for my payments?,15
2567,Why was I charged for payments? You didn't warn me about additional fees.,15
2568,"i have used my card online before and wasn't charged, why am i charged now",15
2569,"I paid with my card and got charged an extra fee, what's up with that?",15
2570,I used my card and there was a fee,15
2571,"I am tired of getting charged fees, and I have no idea why, please let me know what/when you charge fees for.",15
2572,Why am I getting a fee on a card payment?,15
2573,"Hi, I am new to this. Are there any additional fees or charges that I should be aware of? I was looking through the app and I thought I saw something in regards to fee-free allowances.",15
2574,I noticed that i got charged extra for using the card.,15
2575,I paid with a card and there is an extra charge. Why?,15
2576,Can you explain why I am now getting charged a fee for using my card?,15
2577,"There are multiple instances where you added a fee to the payment, as well as some where you didn't. Do you have an outline of when a fee will be added?",15
2578,I have been charged a fee that I didn't know about. Why have you charged me extra for card payments?,15
2579,I got a fee when paying with my card,15
2580,why is there a fee for a payment on my card?,15
2581,"When using my card I was charged a fee for doing so, why?",15
2582,What was I charged a fee for card payment?,15
2583,What is this extra fee?,15
2584,Why did I have to pay extra because I paid with my card?,15
2585,I want to see what this fee is on my card payment.,15
2586,Let me know when you charge extra for payments please. I just checked the app earlier when I saw that there was an additional fee on one of the payments that I wasn't warned about before.,15
2587,how do i avoid charges in the future,15
2588,An extra fee has been added to my card payment is this correct?,15
2589,Why was there an extra charge because I used my card to pay?,15
2590,Why do I have to pay extra for using my card?,15
2591,"Unbeknownst to me, there was an additional charge on my prior transaction. A notification of sorts should be required and explained before future payments are made.",15
2592,I paid with my card and was charged extra,15
2593,My account was charged a fee. When did you start charging extra for card payments?,15
2594,Explain the extra fee on my card when paying.,15
2595,I was charged and shouldn't have been charged when using my card!,15
2596,I have a fee and I don't know why,15
2597,I was mistakenly charged a fee for using my card.,15
2598,tell me why I was charged more with my card?,15
2599,"My card is showing a fee from when I used it, but I thought this card was supposed to be fee free?",15
2600,There was an extra fee when I paid with the card.,15
2601,I think I was wrongly charged in a recent transaction when I used my card.,15
2602,"I have been charged a fee, I didn't know about this fee before! When do you charge extra for card payments?",15
2603,I was spending cash with my card and got a fee.,15
2604,What are these fees i am paying?,15
2605,Why have I been charged a fee for card payment?,15
2606,How come I was charged an extra fee when paying with the card?,15
2607,Why is there a charged fee for debit or credit card payment?,15
2608,Am I getting charged for making a payment?,15
2609,Why do some of my payments have fees?  I don't understand.,15
2610,Why did I have to pay an additional amount when using my card to pay?,15
2611,I paid with my card and I was charged a fee,15
2612,There was a charge applied when I used my card.,15
2613,I was charged a hidden fee when I paid with card.,15
2614,Why does it cost more to pay with my card?,15
2615,Is there a place to check for fee for payments? I feel like I'm getting charged too much at times.,15
2616,I need to be made aware when I am being charged an extra amount for payments please. I looked over the app earlier and noticed an additional feel related to one of the payments. I was not warned about this before.,15
2617,Why was I charged extra when paying with card?,15
2618,Why am I charged a fee when using my debit or credit card?,15
2619,"I am getting charged fees on some payments.  Please help me understand, where are these fees disclosed?",15
2620,Why was the price higher when I paid with my card?,15
2621,I just made an order and noticed an extra fee. Why have you charged me this without informing me?,15
2622,I didn't know I was going to get charged to use my card.,15
2623,I have been charged an extra fee when buying from your store. Why is this?,15
2624,What is this extra fee that I got when I used my card to pay?,15
2625,Was I charged extra for using my card?,15
2626,Let me know when applying extra charges for payments. I just checked the app and saw a fee that I wasn't warned about.,15
2627,Why was I charged an additional fee when paying with card?,15
2628,Why did I get charged extra?,15
2629,I paid with card and I was charged a fee,15
2630,I made a purchase but never expected to see a fee charged for the transaction.,15
2631,I was charged for using my card?,15
2632,My card was charged more than expected.,15
2633,Where can I check to see if there will be a fee added to my payment? Are there specific instances that will result in a fee added?,15
2634,Why have i been charged a fee for using my card?,15
2635,Why was I charged extra using my card?,15
2636,How was I charged extra when I used my card to pay?,15
2637,When do i get charged a fee for using the card?,15
2638,"I see I was charged extra when I used the card.  I am not sure why, please tell me why.",15
2639,Why was I charged a fee for my card payment?,15
2640,Why was I charged an extra fee when using the card?,15
2641,Let me know when you charge for payments. I just checked the app and saw a fee that I wasn't warned about.,15
2642,What is the charge for paying with my card?,15
2643,I paid with my card and ended up being charged a fee.,15
2644,Why is there a fee on a card payment?,15
2645,I was unaware of the additional charge that was added onto my previous payment. A notification of extra charges would be appreciated in the future.,15
2646,I don't think I should have been charged a fee to use my card.,15
2647,A fee that shouldn't be there is there after using my card!,15
2648,"How do I see what fees I am supposed to be charged on my account? I've noticed fees on some transactions, but not on others. This is very confusing and I cannot find a pattern to what I am being charged?",15
2649,Why am I getting charged more for using my card?,15
2650,I see a fee that I think was charged because I paid by card.,15
2651,What are the fees imposed when I make a transaction?,15
2652,What was the extra charge for using my card?,15
2653,Why was a fee added to my bill when I used my card?,15
2654,Please tell my why I was charged a fee for using my card?,15
2655,How can I check how much free spending I have left? I have some big purchases coming up and want to know where I can look for any info.,15
2656,I was charged a fee when buying stuff with my card.,15
2657,I was charged an additional amount of money for making a purchase with my card,15
2658,What is the fee charged for using my card?,15
2659,I just saw a fee on my account. When do these get charged?,15
2660,Is it normal to get charged extra when i use my card?,15
2661,This fee shouldn't be there after I paid with a card.,15
2662,Why am I charged an extra fee on my card?,15
2663,Why did I get charged more for using my card?,15
2664,I recently bought an item using my card and I was charged an extra fee why is this?,15
2665,I am angry that I got charged for using my card.,15
2666,I wanted to know why i got an additional fee when i use my card.,15
2667,"Is there a fee for making a payment? If so, let me know why.",15
2668,Please tell me why I would have to pay a fee for a recent payment. Thanks.,15
2669,Why was I charged a fee for debit or credit card payment?,15
2670,Why was an extra charge added when I used my card?,15
2671,Why have I been charged a small fee to use my card?,15
2672,I was charged an extra fee for a card payment. I was unaware of these fees beforehand.,15
2673,Why is there a fee associated with card use?,15
2674,What is this fee showing up in my account for?,15
2675,I got charged for with a fee for paying with my card.,15
2676,Why am I being charged a fee on a card payment?,15
2677,Is there a  way to  get around fees,15
2678,I noticed an extra fee when I paid with my card.,15
2679,You advertise no fee when paying with a card then my statement shows a fee.,15
2680,"There was an extra fee when I paid with my card, why was i charged this extra fee?",15
2681,Why was there an additional fee on the payment I just made? I don't usually have additional fees applied to my payments.,15
2682,what is this extra charge with my purchase?,15
2683,Hello! I randomly got charged an extra fee today as i was shopping online and i have no idea why! Are there extra fees for card payments? Or am i missing something here?,15
2684,Please explain the extra fee when I paid with the card.,15
2685,When do you charge fees on accounts? I just saw a charge on my statement.,15
2686,After I used my card I saw I was charged a fee for using it,15
2687,Is there an allowance on cards?,15
2688,Why am I being charged a hidden fee?,15
2689,Can you explain why I was charged extra when I used the card?,15
2690,Why did I get charged a fee on my card?,15
2691,Do you have charges now when you pay with a card?,15
2692,What is the extra fee that was added when I used the card?,15
2693,Why am I charged a fee for using my card on some purchases?,15
2694,Why am I being charged a fee for using my card? If there is some print out of places that charge me can you please send me that?,15
2695,How can I tell if there will be a fee added to my payment or not?,15
2696,You promised no fees but now I've got one. What the hell!?,15
2697,How do I know which payments I make will have additional fees? Where can I find this information online?,15
2698,I am worried that too much time has gone by for a transfer to be completed.,66
2699,What is the time frame that it usually takes for a transfer to come through? I have a friend needing it immediately but it has yet to come through.,66
2700,My money transaction can't be seen by the person I sent it to,66
2701,"How long does it typically take a transfer to go through?  I sent some money to a friend earlier today, and she really needs it.  It still is a pending transfer, even though I sent it a few hours ago.",66
2702,"I have done a transfer within the country the day before yesterday, but it's still not there yet. Can you please check what's going on with that, the account number definitely is the right one, I've checked that already.",66
2703,"I have done a transfer within the country the day before yesterday, but it's still not there yet. Can you please check what's going on with that, the account number is the right one, I've checked that several times already.",66
2704,My money transaction hasn't arrived.,66
2705,I sent money to a person and they haven't received the payment yet.,66
2706,I do not know where the transaction is.,66
2707,I transferred money but the recipient does not see the funds in their account?,66
2708,why hasn't a transaction to a friend cleared yet?,66
2709,The app isn't showing my transactions,66
2710,Why isn't the recipient seeing the transaction? I just sent the money.,66
2711,I transferred money and it didn't get there.,66
2712,Is there a reason why a recipient might not see my money transaction,66
2713,I don't see the transaction I made to a friend on my account.,66
2714,why has a transaction to a friend been delayed?,66
2715,"A transaction I did to my friend hasn't arrived yet, why?",66
2716,Where is my last money transaction,66
2717,I am having an issue with an in country transfer I did a few days ago. It has yet to appear in my account. I have checked to be sure that all account information is correct multiple times. What is taking the transfer so long?,66
2718,I made a transfer the day before yesterday within this country. It is still not showing up at all. I have double-checked and the account number is certainly right. I've actually type this multiple times. can you look into what is going on here?,66
2719,How much time do transfers typically take? I sent money to a friend who needs it urgently. It's been hours and has not gone through.,66
2720,A transaction to a friend still hasn't shown up.,66
2721,I sent money and the recipient has not received their money after two weeks.,66
2722,How long will it take for my transfer to arrive?,66
2723,Why did the funds not transfer to another recipient?,66
2724,I sent a payment but it isn't showing up in the app,66
2725,I tried to transfer some money and it hasn't done it yet - what's going on?,66
2726,I made a transfer and they haven't received the money I sent them.,66
2727,"how long does it take to transfer money, my retailer is waiting",66
2728,"I sent money to someone but they haven't gotten it, what's going on?",66
2729,"How long does it take for transfers to process?  I sent funds to a friend, and she says that she has not yet received anything.",66
2730,Why hasn't the transaction I did to my friend arrive yet?,66
2731,I sent money about 5 days ago and the recipient has not received the money yet.,66
2732,I am just waiting on the completion of the transaction.,66
2733,My cash transaction isn't showing on my account,66
2734,Why hasn't my transaction arrived?,66
2735,When are you going to transfer the money?,66
2736,"I have moved to a new house and set up a rent payment to my landlord, it was supposed to be in her account a few days ago but it hasn't arrived.  I definitely sent it to the right place, can you confirm where the money is?",66
2737,I need to check status as my friend hasn't got money I sent.,66
2738,How long do transfers typically take? Is there a way of speeding the process up? My friend needs the money I sent her desperately.,66
2739,wheres my money receipt,66
2740,Money is not in recipients account.,66
2741,How long does it take for money to transfer?  I sent some to a friend and it hasn't gone through yet.,66
2742,Why hasn't the transaction I did to my friend arrived yet?,66
2743,"How much time do transfers take? I sent money to a friend who needs it fast. It's been hours, and the money has not gone through.",66
2744,"How long should a transfer normally take to process completely? I have a friend that needs it right away, but it's already been 2 hours and she hasn't received it.",66
2745,My friend says he hasn't received my transaction,66
2746,What is the length of a transaction completion?,66
2747,I transferred some cash and it has not arrived yet.,66
2748,I need to transfer some money to a friend who is in urgent need of some fast cash. How long will it take before she can use that money?,66
2749,Two days ago I did a transfer to another account within the country.  It doesn't appear the transfer went through.  I have verified the account number several times.  Could you please check on this for me?,66
2750,Where did the money transfer go?,66
2751,When will the transaction be done?,66
2752,I transferred some money to my mom 2 days ago and she has not received it. I double checked the information and it looks right. Can you help me?,66
2753,Why is it taking so long for a transfer to complete!,66
2754,Why is my transfer taking so long to complete?,66
2755,I am just waiting for the transaction to be completed.,66
2756,How long do I have  to wait for my transaction to be completed?,66
2757,I did a money transaction and the recipient doesn't see it,66
2758,Why hasn't my friend received the money i sent them yet?,66
2759,I sent money for my rent to my landlord but she is claiming it hasn't arrived in her account  Can you trace the transfer I made to make sure it arrived so I can provide proof I sent it and that it has been deposited?,66
2760,Why didn't my friend's transaction arrive yet?,66
2761,Still waiting for transfer to be completed.,66
2762,I transferred some money but it is not here yet,66
2763,What do I do if I completed a money transfer but the recipient hasn't received it?,66
2764,"I have done a transfer within the country a couple days ago, but it's still not there yet. Can you please check what's going on with that, the account number definitely is the right one, I've checked that several times already.",66
2765,I'm still waiting for my transaction.,66
2766,Why hasn't a transaction I did to my friend arrived yet?,66
