,text,label
7471,"Hello.  I ran into a problem with a transfer this morning.  I was trying to send money to some friends but when I tried to send it, the transfer failed.  I don't know what is causing the transfer to be rejected.  Please let me know what is causing the problem.  Thanks.",35
7472,"So, I am in the middle of purchasing a flat. I need the money for the first mortgage payment and it is not going through. I keep receiving an error. Can you find out what's going on and help me complete this transfer?",35
7473,Can you tell my why my funds transfer did not work properly?,35
7474,Why didn't my transfer work?,35
7475,"Hi there, I've tried to make a transfer 5 different times and its not working. Is your system down or something?",35
7476,Why can I not make a transfer?,35
7477,"My transfer failed, why did that happen?",35
7478,The app says my transfer failed,35
7479,Is there a reason my transfer failed?,35
7480,Why was my transaction not approved?,35
7481,I attemped a transfer and it didn't go through.,35
7482,is the a reason why my transfer has failed?,35
7483,The transfer I tried to make failed.,35
7484,Can you please assist me in completing a transfer? I'm trying and I keep getting an error. I'm trying to purchase a flat and pay the initial mortgage payment. All I keep getting is an error. Can you find out what's happening here?,35
7485,"Why can't I transfer my money into someone else's account? I should be able to do so right? Why does it keep rejecting my transfer? There's no reason, all my info is correct and the money is there.",35
7486,"Hello, I am buying a flat and need the inital payment for the mortgage to go through. It keeps showing up as error, what is going on? Can you please help me make this transfer?",35
7487,Why can't I complete my transfer?,35
7488,"My card couldn't complete a transfer, why?",35
7489,"Hey, I'm buying a flat and I need my mortgage to go though. However, every time I check I get an error message. Is there any way you can help me with this transfer.",35
7490,"Errors keep showing up every time I try to make this transfer and I am on a time crunch,  could you please help.",35
7491,Why do my transfers keep failing?,35
7492,Why didn't this transfer work?,35
7493,"Hi, I have been transferring money to my friends since morning, but all my transactions were getting failed. Can you please look into this issue.",35
7494,"My transfer did not work, what was the reason?",35
7495,What do I need to do to correct this failed transfer?,35
7496,I tried to do a transfer and it hasn't worked!,35
7497,What went wrong when I tried to do my transfer?,35
7498,Why does it say my transfer failed?,35
7499,I don't think my transfer wen through. Why?,35
7500,How can I find out why my transfer didn't go through?,35
7501,"I needed to send my friends some money urgently.  I tried multiple times to transfer the money this morning, but the transfer keeps failing.  Can you tell me why the transfer is getting rejected?",35
7502,I tried to make a transfer and it failed.,35
7503,"After I attempted a transfer, it failed.",35
7504,I couldnt transfer money from my account.,35
7505,"What stopped my transfer, from being accepted?",35
7506,I've already tried 5 times to complete a transfer that's just standard. What's the deal? Is your system down at this time?,35
7507,What caused my transfer to fail?,35
7508,My transfer failed,35
7509,"I tried to make a transfer, but it didn't work.",35
7510,How is this transfer supposed to work? It's not working for me.,35
7511,"This morning, I tried to send money to my friends several times but each time the transfer fails.  Why does it keep failing?  The transfer gets rejected but I do not know what is causing it to be rejected.",35
7512,I'm trying to purchase a flat but i need my first payment for my mortgage to go through first. I keep getting an error. I'm not sure what is going on but i need help making this transfer.,35
7513,"My transfer failed, why?",35
7514,My transfer is failing when I try to do it.,35
7515,I can't seem to make a standard bank transfer. I have tried at least five times already but none of them are going through. Please tell me what is wrong?,35
7516,What may be the reason that my transfer did not go through?,35
7517,I tried to transfer money but it didn't go through,35
7518,My transfer didn't complete. Why can't I access funds?,35
7519,Been trying to transfer money this morning but keep getting rejected. I don't understand why this is happening.,35
7520,"Hi, I'm trying to purchase a flat and I'm needing the first payment for the mortgage to go through on the flat I'm trying to buy. For some reason I keep getting an error.can you assist in making this transfer? What is going on?",35
7521,My transfer didn't work how come?,35
7522,Hi I'm sending some money over to an investment bank I do business and the transaction is being rejected. I'm not sure why as I think I have the right details.,35
7523,I think my transfer failed. What do I do now?,35
7524,"I attempted a transfer, but it failed.",35
7525,I couldn't make a transfer,35
7526,Hello. I'm trying to transfer some money to a friend but it keeps getting rejected. can you help me?,35
7527,"The transfer keeps rejected, I tried to transfer some money to friends but it keeps getting rejected for some reason, Would you please check the issue?",35
7528,I've been trying to make a transfer and it doesn't seem to be working. (5 times) What is wrong with your system?,35
7529,Why are my transfers not going through.  I have tried over 4 times to get it to work.  This is just a simple transfer.  Is something else causing this in the system?  Is it broken?,35
7530,Why was I not able to complete my transfer?,35
7531,"The transfer keeps failing , I tried to transfer some money to friends this morning but it keeps getting rejected for some reason, Would you please check the issue?",35
7532,Why was my transaction declined?,35
7533,Why wouldn't a transfer go through?,35
7534,Can you please tell me why my transfer failed?,35
7535,I did a transfer earlier but see that it failed to go through.,35
7536,Why has my payment not transferred?,35
7537,I tried to do a transfer but it didn't go through.,35
7538,The attempted transfer failed.,35
7539,I need help making this transfer. I keep getting an error. I'm trying to purchase a flat but i need my mortgage payment to go through first. Can you help?,35
7540,Why does my transfer keep failing? I've tried 5 times and they all failed.,35
7541,A mortgage payment I'm making is giving me an error message.  This is the first time I'm making this payment and want to know what's wrong.,35
7542,"Hi, can you tell me why my transfer keeps being rejected? I've been trying to send money to my friends this morning but failed every time and I have no idea why?",35
7543,I need assistance completing a transfer. I'm trying to purchase a flat and need the money for the initial mortgage payment. I keep getting an error and the transfer is not going through. What is going on here?,35
7544,What are the reasons that my mortgage payment won't go through? I'm getting an error and don't know how to correct to get this transfer to go through.,35
7545,Why was I unable to complete my transfer?,35
7546,"Hi, I'm buying my son Bertie a starter home in London.  I'm just trying to send the 5% deposit over to the agent. It's only £200,000 but seems to be throwing an error.  What is going on?  If I wait any longer the house prices might rise, can you look in to it please?",35
7547,I'm trying to make a bank transfer but It's not going through. Could there not be enough funds to transfer or something? Have I done it too many times?,35
7548,I need to know what is going on. I'm attempting to purchase a flat and need the money to pay on my initial mortgage payment. I'm only getting an error. Can you find out what's going on and help in making the transfer?,35
7549,Can you please explain why my transfer failed?,35
7550,I think youre system may be broken because I have tried transfer money 5x and it isnt working!  I'm not doing anything complicated it is what I usually do.,35
7551,I am trying to transfer money and something is going wrong.,35
7552,I am unsuccessfully trying to make a transfer can you help?,35
7553,"I can't transfer any money from my account to my friend's account, it keeps rejecting it. Can you tell me why? I have enough funds in my account to transfer.",35
7554,Why did the bank reject my transfer?,35
7555,"I tried and tried, but I could not complete my transfer. Tell me what is wrong.",35
7556,I'm getting an error when trying to make a payment. I want to purchase a flat but my mortgage payment needs to go through. Can you help me?,35
7557,The transger I tried to make failed.,35
7558,"When I tried to transfer funds to my friend today I was unable to do so, why?",35
7559,"I've tried to send money to my friends and I keep getting rejected. Can you please tell me why, I don't understand.",35
7560,why do i have a failed transfer,35
7561,I've tried completing a very standard transfer and have already attempted it 5 times. What's going on here? Is there a problem with your system?,35
7562,"When I attempted to make a transfer, it failed.",35
7563,Why can't my transfer complete?,35
7564,Why can't I complete the transfer?,35
7565,I want to transfer money. How do I do that for my account?,65
7566,How do I transfer money into my account?,65
7567,How can I link my bank to my top up account?,65
7568,I have an account that is empty of funds. Can I transfer some from another bank?,65
7569,HOW DO I TRANSFER MONEY FROM MY BANK ACCOUNT?,65
7570,Whats the transfer process,65
7571,How can you assist me on topping up on bank transfers to my account?,65
7572,Can I add money to my account via bank transfer?,65
7573,I want to op up my account by using bank transfer. How do I go about it?,65
7574,I have questions about how to transfer money to my account.,65
7575,I need to add money to my account. Can I do so via bank transfer?,65
7576,Can I use my bank account to send me more money?,65
7577,I can't figure out how to transfer money into my account.,65
7578,Can you please explain how to transfer money using the bank transfer process?,65
7579,How simple is it to transfer money into my account?,65
7580,How can my account have money transferred into it?,65
7581,"I am in desperate need to transfer funds from another account that i have into this one, how do i do that?",65
7582,How do I use bank transfer to top up my account?,65
7583,How do I top up?,65
7584,Why can I not transfer money into my account?,65
7585,How can I move money from an account at another bank to this one?,65
7586,What process should I use to transfer money into my account?,65
7587,"I want to transfer money into my account, what do I do?",65
7588,I need to deposit money to my account,65
7589,Can you transfer money to your card by bank transfer?,65
7590,What do you do to transfer money to my account?,65
7591,How can I move money from my account at a different bank to the account I have at this bank.,65
7592,Please provide details on how to top up my account using transfer option,65
7593,Where can I find out how to transfer money into my account.,65
7594,How does it work when I transfer money into my account?,65
7595,I need assistance with transferring funds to another account.,65
7596,How can I add money to my account from another account I have?,65
7597,I have money in a foreign account that I want to send to this account.,65
7598,How can I transfer money into my account?,65
7599,I need to move money from another bank to this account.,65
7600,I need to transfer money into this account from my other bank account.,65
7601,How do I go forth with bank transfers for top up accounts?,65
7602,"I have an account at another bank, but I want to transfer some of the money to my account here.
.",65
7603,"I want to do a bank transfer to this bank, from an account at another bank.",65
7604,What are my bank details so I can do a transfer?,65
7605,How would I use a bank transfer for topping my account?,65
7606,I would like to know how to transfer money into my account.,65
7607,My account is devoid of funds. Am I permitted to submit additional money via bank transfer?,65
7608,How does a bank transfer for topping my account work?,65
7609,I'd like to know how transferring my money into my account works.,65
7610,How is my money transferred to the account,65
7611,How do I top up my account with a bank transfer?,65
7612,I need to transfer money to my account from another bank,65
7613,I would like to transfer money into my account.,65
7614,I would like to transfer money from my checking account to my savings account.,65
7615,I want to transfer money into my account,65
7616,What transfer methods do you accept?,65
7617,"I need to transfer money into my account, and I don't know how to do that.",65
7618,"I need to transfer money into my account, HOW?",65
7619,Can I transfer money to my card via bank-transfer?,65
7620,How can I transfer some money into a foreign account?,65
7621,I need to know the process to transfer money into my account.,65
7622,Can I add money to top up my account via a bank transfer?,65
7623,What currencies can I use to top up my account?,65
7624,How do I top up my account using transfer?,65
7625,Account topping up bank transfers to my account assistance please?,65
7626,I want to take some funds from my other bank account and add them to this one.,65
7627,I need more money in my account. Can I add more by transferring?,65
7628,How do I go about transferring money into my bank account?,65
7629,How do I go forth on transferring a sum of money from one account to another?,65
7630,How do I initiated a bank transfer to top up?,65
7631,How can I transfer money between accounts?,65
7632,Whats the process of tranfering money into an account?,65
7633,"I would like to top up my account with a bank transfer, is that allowed?",65
7634,How can I deposit money to my account?,65
7635,I have zero dollars in my account. Can I submit additional funds via bank transfer?,65
7636,What are the steps for  making a transfer for topping up?,65
7637,"For my account, how do I transfer money in?",65
7638,How do I transfer money between two of my accounts?,65
7639,What is the procedure to transfer money to my account?,65
7640,Is a bank transfer acceptable for topping up my account?,65
7641,I have no more money in my account.  Is there a way to do a bank transfer to put money into my account?,65
7642,I need to transfer funds from my other bank account into this bank account.,65
7643,I want to transfer a sum of money from another bank account I have into this one,65
7644,Can I transfer money to my account with the app?,65
7645,Can you tell me how transferring money into my account works?,65
7646,Help! My account doesn't show any funds. Is transferring funds an option I can use?,65
7647,How do I transfer cash my into my account?,65
7648,How can I top up my account by bank transfer?,65
7649,I was wondering about transferring money into my account and how it works.  Can you tell me about that?,65
7650,My money is all gone. What ways are okay to add money to my account?,65
7651,I need to move money from one of my other accounts to this one.,65
7652,What is the process for transferring money into my account?,65
7653,Tell me how to top up my account using bank transfer.,65
7654,Can I top-up my card using a bank transfer.,65
7655,Can I use a bank transfer to add money to my account?,65
7656,"I want to top up by transfering accounts, What do I do?",65
7657,show me how to transfer to my account,65
7658,How does your app transfer the money,65
7659,How do I deposit through bank transfer?,65
7660,My account is depleted. Can I transfer funds from another bank?,65
7661,Can you please explain the topping up transfer process?,65
7662,What can I expect if I use bank transfer to top up my account?,65
7663,I want to transfer some money from my other bank account into this one.,65
7664,I want to transfer money from another account into this one.,65
7665,I would like to move money from one account to another to top off my account. Can you explain how I can do that?,65
7666,Can I withdraw money from another bank and transfer it into my empty account?,65
7667,How can I go about transferring money to my account?,65
7668,How can I transfer money to this account from another bank?,65
7669,can i transfer money i the app,65
7670,How do I transfer money from one bank account to another?,65
7671,What steps are taken to transfer money into my account?,65
7672,I am out of money in my account and I was wondering if I could do a bank transfer is put more in it?,65
7673,Can you please explain how bank transfers work?,65
7674,Can you help me transfer funds from another bank account to this account?,65
7675,I am looking to transfer some money from my other bank account into this one.,65
7676,where do i go to transfer money from one account to this one,65
7677,I need money put into this account from another one.,65
7678,Do you know how I can verify that I did a top-up to my card?,71
7679,where is the code for verifying the top up card?,71
7680,The top-up card is verified how?,71
7681,Tell me about verifying top-up,71
7682,What is the verification code for my top up card?,71
7683,Explain to me how to verify the top-up card.,71
7684,How can I verify my top-up card?,71
7685,Can you show me how to verify the top-up card?,71
7686,Can you explain to me the way to verify my top up has gone through?,71
7687,I can't find the top-up card verification code.,71
7688,I would like to receive instructions showing the verification process for top up cards..,71
7689,Where is the top-up verification code located?,71
7690,For what reason must I authenticate the top up?,71
7691,what's my top-up verification code?,71
7692,Why do the top-ups need to be verified?,71
7693,Does the top-up need verified?,71
7694,I am having trouble finding the top-up card verification code.,71
7695,Why do you ask for top-up verification?,71
7696,Where can I find the top up verification code?,71
7697,How is top-up verified?,71
7698,Do I need to verify my top-up card?,71
7699,How do i verify my card?,71
7700,What is the point of verifying a top up?,71
7701,How do I verify my top up?,71
7702,How do I find the top-up verification code?,71
7703,Why does top-up need to be verified?,71
7704,why do i have to verify top up?,71
7705,"I'm trying to verify my top-up card, but I can't find the code...?",71
7706,How can I verify the top-up card?,71
7707,how do I find the code to verify the top up card?,71
7708,I need to find the top up verification code,71
7709,Please help me find my top-up verification code,71
7710,Where can I find the verification code for the card top-up?,71
7711,Do I need to verify my top-up?,71
7712,Why do we need to verify a top-up card?,71
7713,I have a top up card. Where is the verification code?,71
7714,How do I find the code needed in order to verify my top-up card?,71
7715,How do i find my top-up card's verification code?,71
7716,How do I verify the top-up?,71
7717,How many digits identify the top-up verification code?,71
7718,What is the significance of verifying the top-up?,71
7719,Why do we need to verify top-up?,71
7720,Please verify my top-up card,71
7721,Is there a reason why top-up needs verifying?,71
7722,I don't know where the top-up verification code is.,71
7723,Verifying the top-up seems like a hassle.,71
7724,I can't see a verification code anywhere,71
7725,Verify top-up card help?,71
7726,What do I do to verify a top-up?,71
7727,Is there a way to verify a card top-up?,71
7728,How to verify top up card?,71
7729,Why are top-ups being verified?,71
7730,why verify the top up? it doesnt make sense,71
7731,The top-up verification code is not visible.,71
7732,"I just tried to top-up and now I'm getting an additional verification message, why?",71
7733,Where do I find my code to verify my top-up card?,71
7734,Why verify the top-ups?,71
7735,can you tell me where to find the top-up verification code?,71
7736,How do I verify the top-up card?,71
7737,Help me verify the card used on a top-up.,71
7738,"On a card top-up, where can I verify?",71
7739,"I'm trying to verify my top up card, how do I do that?",71
7740,What is the verification process used for?,71
7741,Where is my top-up verification code?,71
7742,Where can i find my top-up verification code?,71
7743,Where is the top-up verification code?,71
7744,I don't see a code anywhere on my top-up card? Where can I find it? I need to verify!,71
7745,Why do i have to verify my top-up card?,71
7746,Do I have to verify the top-up?,71
7747,Why do I need to verify the top-up?,71
7748,Where can I find the verification code for the top up card?,71
7749,I can't see a top-up top-up verification code.,71
7750,I don't see the verification code for my card transfer.,71
7751,Why does top-up require verification?,71
7752,is there a reason i need to verify top up,71
7753,Is the verification number on the top up card,71
7754,What  is the verification process for a top up card?,71
7755,Where is the top-up card verification code?,71
7756,How do I verify the top up?,71
7757,I am looking for my top-up verification code and cannot find it.,71
7758,How do i authenticate a top-up card?,71
7759,Do I need to verify the top-up?,71
7760,What's the deal with verifying the top-up?,71
7761,Can you tell me where to find my top-up verification code?,71
7762,Where Is the top up verification code found?,71
7763,Please tell me how to verify my top up card.,71
7764,How do i secure a top-up card?,71
7765,What's up with verifying top-ups?,71
7766,Why do I need to verify a top-up?,71
7767,Can I verify my top-up card?,71
7768,Why is it necessary to verify the top up?,71
7769,Why should I verify the top-up?,71
7770,this verifying the top up is annoying,71
7771,Why do we need to verify top-ups?,71
7772,How are top-ups verified?,71
7773,Tell me how I can verify a card top-up.,71
7774,Do i need to verify my top up?,71
7775,My top up card needs verification and I don't know how to do it,71
7776,Where's my top up code?,71
7777,Where do I find the verification code for the card I'm topping up?,71
7778,Where can I find the verification code for a top-up?,71
7779,Where do i verify a top-up card?,71
7780,What is the top up code for?,71
7781,why do you verify the top up,71
7782,Tell me why I need top-up to be verified?,71
7783,"I just want to top-up, why do I need to verify anything?",71
7784,Verifying top-up cards necessary?,71
7785,Where is the top-up verification code sent?,71
7786,What's a verification code?,71
7787,Tell me how to verify a top up.,71
7788,Where is the verification code display?,71
7789,What can I do to verify my card?,71
7790,Why is top-up verified?,71
7791,Why do I need top-up to be verified?,71
7792,How do I authenticate my top-up?,71
7793,What is the verification process for my card?,71
7794,i don't see the top-up verification code anywhere,71
7795,I'm being asked for a verification code. Where do I find it?,71
7796,Why does a top- up need to be verify?,71
7797,Help my find the verification code on a top-up.,71
7798,How can I verify my top up?,71
7799,I need help finding the verification code on the top up card.,71
7800,What does top-up verification do?,71
7801,I CAN NOT FIND THE TOP-UP VERIFICATION CODE.,71
7802,How do I go about verifying the top-up card?,71
7803,why do i need to verify the top up?,71
7804,Are extra charges added for sending out additional cards?,39
7805,I'd like to order an additional card,39
7806,I want some extra physical cards.,39
7807,"I would like open a second card for my daughter, how can you assist me?",39
7808,Am I gonna be charged for sending out more cards?,39
7809,Would I have to pay anything if I need an additional card?,39
7810,Is it possible to get a second card for my daughter?,39
7811,Can I get a few more physical cards?,39
7812,What's the limit on total number of cards I can have?,39
7813,Is there a charge for sending out more cards?,39
7814,How much does it cost to get more cards?,39
7815,How can I create another card linked to this account?,39
7816,May I order another card?,39
7817,Can I order another card?,39
7818,Can I order a second card?,39
7819,Can I have more physical cards?,39
7820,How many physical cards am I allowed to have?,39
7821,I want to get few more physical cards,39
7822,Please tell me if I'm going to be charged for sending out more cards?,39
7823,Can I get more cards just incase?,39
7824,Would I be able to get a second card?,39
7825,Do you charge for sending out more cards?,39
7826,I need a second card on this account for my daughter.,39
7827,How can I get another card?,39
7828,Can I have a third card?,39
7829,I have left my card at my parents house. Can you send me a spare one please to use in the meantime?,39
7830,I'd like to provide my daughter with a card - could I get an additional card from my account to give her?,39
7831,What is the price for an additional card?,39
7832,Can I get a second card for free?,39
7833,Will I be charged if I add more cards to the account?,39
7834,How many cards am I allowed?,39
7835,"Can my daughter also have a card issued in her name, but linked to my account?",39
7836,I'd like to order another card,39
7837,Can I have a supplementary card?,39
7838,"I lost my card and need a new one, will it cost me?",39
7839,My daughter need a card from this account. Is that possible?,39
7840,My daughter would like a card from my account?  Can I do this?,39
7841,Are there any fees to get additional cards?,39
7842,Can you send me more cards for my account?,39
7843,"I would like some more physical cards, what is my limit?",39
7844,Can I have a duplicate second card?,39
7845,"I want to give a second card for this account to my daughter, would this be possible?",39
7846,What is the procedure for me to get more cards on my account?,39
7847,Am I permitted to have a spare card?,39
