,text,label
5094,The purchase I made is still pending.,45
5095,Is there a problem with the payment that I see is still pending?,45
5096,There is a payment that I made that hasn't gone through yet.,45
5097,How long does it actually take for a card payment to go through? There's one stuck since a couple days already that doesn't seem to move,45
5098,Why does my payment appear as pending?,45
5099,How long does a payment usually show as pending? Is it normal that mine is still pending?,45
5100,Why is my payment in pending status?,45
5101,I have a card payment which shows as pending,45
5102,I made a payment with my card and it hasn't changed. How long do you think this will take?,45
5103,Why is the payment showing as pending from things I bought this morning?,45
5104,I made a card payment which is showing me pending.,45
5105,Why are my payments not working and show pending?,45
5106,"I put in a payment a while ago and it has still not cleared and is showing up as ""pending"", how long does it take to clear?",45
5107,Why are the things I bought earlier today still showing as pending?,45
5108,Card payment still pending.,45
5109,"My card payment is just showing up as pending since forever, what's going on with that, it should be going through at some point?",45
5110,I have a payment that has not gone through yet,45
5111,"I initiated a payment a while ago and it is still showing as ""pending"", how long will it take to clear?",45
5112,Why is my purchase showing as pending?,45
5113,How long will it take for my payment to go through?,45
5114,After making a payment with my card it doesn't seem to have worked. It's just showing to be pending. When will this actually be going through?,45
5115,"It says ""pending payment?"" Why is it saying this?",45
5116,Is there a reason my payments are pending?,45
5117,Why is my card payment still a pending transaction?,45
5118,"Card payment is still pending, why is that the case?",45
5119,I have been waiting for my card payment to be moved from pending status for an unusually long time.  What is going on here and do you have an idea of when I can expect it to go through?,45
5120,How come my card payment is still pending?,45
5121,I notice there's a pending payment on my card.,45
5122,How is my card payment still pending?,45
5123,Why is my card payment still pending?,45
5124,What does pending payment mean?,45
5125,Why is my payment still pending?,45
5126,What does it mean when it says that I have a payment that is pending?,45
5127,My card payment is showing pending however this transaction was a couple of days ago. Is there a reason why it it still pending?,45
5128,A card payment on my account is shown as pending.,45
5129,Why is their a charge pending on my card still?,45
5130,My card payment says pending and it hasn't changed,45
5131,Card payment is showing as pending,45
5132,What is the longest that a payment will show pending?  There is one showing that has been sitting there a few days.,45
5133,I tried to pay through my account but the payment is not going through. What's going on?,45
5134,Why is the payment on my card still pending?,45
5135,What's taking so long for this payment to go through?,45
5136,Why haven't I gotten my payment yet?,45
5137,It looks like a payment I've made hasn't made it through yet.,45
5138,My card payment has had the status of pending forever. What is the issue? It should have gone through at some point.,45
5139,A payment is pending,45
5140,Why hasn't my card payment cleared yet?,45
5141,I've made a card payment a couple of days ago now but it looks like the money is stuck. How long does it typically take for the payment to go through?,45
5142,My payment is taking a long time to go through.,45
5143,What does it mean if my payment is pending?,45
5144,When will my payment go through?,45
5145,My card payment still pending,45
5146,How long does a payment show as pending before i should worry about it?,45
5147,Why is my card payment pending?,45
5148,I made a card payment by my card but it failed. Please let me know when the payment will get completed as its still pending.,45
5149,"Hi, status of one of my card payment is still pending from a while. Please let e know how much time it will take to complete.",45
5150,"After I make a payment, how long will it be before it transitions from ""pending"" to complete?",45
5151,"My card payment is showing up as pending for a very long time, what's going on with that, it should be going through at some point?",45
5152,My purchases from this morning are showing up as payment pending. Can you tell me why?,45
5153,There is a payment that has not processed.,45
5154,I'm still waiting on a payment,45
5155,I need to find out why my pending payment hasn't gone through.,45
5156,I am waiting for a payment to be processed,45
5157,I don't understand why my card payment is pending.  It has been pending for too long.  Why is this and when might it go through?,45
5158,"I did a payment with my card but seem that didn't work, it's still listed as pending since a while ago. When does this actually go through?",45
5159,I need to know when a payment will actually go through. I completed a payment using my card but it is just showing as pending at this point and it has been a while ago.,45
5160,When will the transaction go through?,45
5161,My card payment has been stuck on pending. What is the problem? It should have gone through by now.,45
5162,Why is the purchase I made this morning still pending?,45
5163,A transaction on my card shows as pending.,45
5164,I have a pending payment on my card.  Why?,45
5165,I have a card payment that has been pending for some time and would like to know when it is going to go through.,45
5166,"I made a payment a while ago and it is still showing as ""pending"" in the account. How long will this payment take to complete?",45
5167,What does a 'pending payment' mean?,45
5168,"Hello, I made a payment with my card and it's not working. It's been a while and still says its pending. Can you tell when this will go through?",45
5169,"Hi,  One of payment is still coming as pending for which i have already paid by card. I guess it did not processed, could you please check and update me.",45
5170,My purchase from this morning still is pending.,45
5171,Why is my card payment still listed as pending?,45
5172,One of my card payments looks like it's stuck but I have made the payment days ago. How long until the payment will be applied to my account?,45
5173,I don't know what pending transaction means.,45
5174,"My card payment is just showing up as pending since forever, what's going on with that, when should it be going through?",45
5175,It says pending status for my payment. Why?,45
5176,pending transaction?,45
5177,I noticed that there's a payment on my card that's pending.,45
5178,When is a payment I made with my card going to clear>,45
5179,My card payment has been pending for a long time now. Why is it taking so long to take. It should have already made it through.,45
5180,What does it mean if it says that my payment is pending?,45
5181,Why are my purchases from this morning still pending?,45
5182,"I was wondering why my payment hasn't gone through yet, its been a while.",45
5183,My card payment has been on pending forever. What is the problem? It should have gone through at some time by now.,45
5184,I did a card payment but its status is still coming as pending. Please check and inform when it would complete.,45
5185,I have made a card payment but it did not completed still showing as pending. Please tell me when it will be completed.,45
5186,Why hasn't my payment gone through?,45
5187,Why is my card payment still pending? It should have gone through already.,45
5188,"I made a purchase this morning, and it is showing as pending.",45
5189,There is a single payment on my card which shows as pending.,45
5190,How long does it actually take my card payment to make it to the account? I've made a payment a couple of days ago but it hasn't moved since.,45
5191,How long does it take for my payment to process?,45
5192,Why would my payment for my card show as pending?,45
5193,Why aren't my payment funds available to me?,45
5194,I got some items this morning but the payment says pending,45
5195,Why is the payment I made still pending?,45
5196,Is there a problem that makes my payments show pending?,45
5197,I made a purchase earlier today but it is still listed as pending- when will it go through?,45
5198,Why didn't my payment process,45
5199,I have a payment that hasn't went through yet.,45
5200,I made a payment but it's still pending,45
5201,How long does it take for a new purchase to stop being considered pending?,45
5202,I was wondering how long does it take for a payment to go thru? It seems my last payment is stuck and hasn't moved.,45
5203,What is the cause of the delay in applying my card payment to my account?,45
5204,Why would my payment still show as pending?,45
5205,I have a payment which has not been approved.,45
5206,What does it mean when it says I have a payment pending?,45
5207,"There is a pending payment on my account, what does this mean?",45
5208,Why has my card payment not yet been applied to my account?,45
5209,I bought some things in the morning but the payment shows as pending,45
5210,I don't know what a pending payment is.,45
5211,why do I have a pending payment?,45
5212,How long does it actually take for a card payment to go through? There's one stuck since a couple of days already that doesn't seem to move,45
5213,I purchases several items today. Why are they still showing pending?,45
5214,There is a payment showing as pending and hasn't posted for a few days.  When will it post?,45
5215,"I have made a payment by my card, and its still pending since a long time. Could you please tell me when it will process.",45
5216,I completed a payment with my card a while ago. It's still showing up as pending. What time frame does this normally take? It doesn't appear to have worked.,45
5217,The payment on my card shows as pending.,45
5218,I have a payment that is still pending,45
5219,I bought something this morning and the payment is still pending,45
5220,"There is a pending transaction on my account, what does this mean?",45
5221,I made a payment that's pending. Will it go through?,45
5222,It's been a few days since I've tried to pay a seller but the funds aren't going through. What is happening?,45
5223,I made a payment that seems to be stuck. It's been a couple of days already. Can you tell me how long it will take?,45
5224,I made a payment that is not yet complete.,45
5225,Why hasn't my payment shown up yet?,45
5226,What is the meaning of a pending payment?,45
5227,My payment is in the app but hasn't gone through yet,45
5228,How many days does a regular transaction take to complete?  I see a pending payment that hasn't changed in the last several days.,45
5229,Why hasn't my payment gone through yet?,45
5230,My payment's stuck on pending.,45
5231,Is there a reason my payment is still pending?,45
5232,What's the pending length for credit transactions? I've had one in my pending category now for days and it won't move to processed.,45
5233,How long does it take for a payment to change from pending?,45
5234,My credit card payment has been in pending status for a super long time.  I don't get it.  Why is it like this?  When will it go through?,45
5235,Why hasn't payment gone through yet?,45
5236,Why is this payment pending?,45
5237,Why is the payment from my card still pending?,45
5238,What is the pending payment on my card about?,45
5239,"It says that my payment is pending, what does that mean?",45
5240,I tried to make a payment with my card and it was declined. Why is it pending?,45
5241,Why is it saying I have a pending payment?,45
5242,"Is there something wrong with my card payment? It's been pending a really, really long time.",45
5243,My purchases from this morning still have pending payments.,45
5244,When will my pending payment finish?,45
5245,"I used my card to make a payment a while ago and its still pending, Why is it taking so long?",45
5246,How long does it take for a purchase to go from pending to authorised?,45
5247,"My card has been pending for a while, what should I do?",45
5248,There is a payment that i made that i noticed has not gone thru yet. Can i ask why?,45
5249,"My card payment is just showing up as pending and it has been a while , what's going on with that, it should be going through at some point?",45
5250,How long will my payment be pending?,45
5251,"My phone was stolen, what should I do first?",42
5252,"My phone was stolen, what should I do?",42
5253,"I lost my phone, what should I do?",42
5254,"Someone has stolen my phone, what should I do?",42
5255,I think I lost my phone.  Is there a way to prevent anyone from getting into my account on it?,42
5256,My phone was stolen! What do I need to do?,42
5257,Can I use the app without my phone?,42
5258,"My bag was stolen from me yesterday, so I can't use any apps or anything. I need some help.",42
5259,"Someone stole my phone, what is my next step?",42
5260,"I forgot my phone at the hotel, so I can't access the app.",42
5261,"Help, my phone was stolen, please advise!",42
5262,my phone was lost,42
5263,I need help- I got mugged yesterday and they took everything so I can't use the app.,42
5264,I can't find my phone and I'm worried someone is going to use it,42
5265,I lost my phone! Will my card still work?,42
5266,I can not find my phone or it has been stolen.,42
5267,I can't use the app because I got mugged yesterday and they took everything. Please help.,42
5268,Can you tell me what i steps i should take since my card was stolen?,42
5269,What do I do if my phone was stolen?,42
5270,What do I do if I can't access the app?,42
5271,What do I do if my phone is stolen?,42
5272,I left my phone somewhere and can't use the app.,42
5273,Someone mugged my and stole everything.  I can't use the app.  What should I do?,42
5274,"I got mugged yesterday and they took everything. I can't use the app, so I need some help.",42
5275,I am not sure where my phone is.,42
5276,"If my phone was stolen, do I need to do anything?",42
5277,Please help!  I was mugged and everything stolen.  What do I do to stop them from accessing my account?,42
5278,I have an emergency and lost my phone.  I need help accessing my account.,42
5279,"stolen phone, what should i do",42
5280,Help me.  My phone has been lost or stolen!,42
5281,My app was on the phone and I was mugged.  What do I do?,42
5282,I don't have the device I used to log onto the platform so I can't access it.,42
5283,I lost my phone. Can I use my card without the app?,42
5284,What should I do if my smart phone is lost or stolen?,42
5285,"If I lost my phone, what steps do I need to take to stop someone from using my account?",42
5286,Can someone else use my account if they have my phone?  I lost mine.,42
5287,"My phone was stolen, help!",42
5288,"phone is gone, what should i do",42
5289,"I'm currently not in possession of my phone, is it still possible to go about things normally without access to the app?",42
5290,I lost my phone. Can I disable to app?,42
5291,"phone is gone, dont want others to access account information",42
5292,Is there something that I can do since my phone was stolen yesterday?,42
5293,I think my phone was stolen. What can I do?,42
5294,Is it possible to access my phone from the hotel/,42
5295,I lost my phone. What do I need to do?,42
5296,Someone has taken my phone from my hotel room!,42
5297,Can my account me accessed by a thief?  I was mugged.,42
5298,My phone is missing or stolen.,42
5299,I misplaced my phone so I can't use the app! Does this mean I can't use my card?,42
5300,I left my phone at the hotel I was staying at so I can't use the app!,42
5301,"My phone was stolen yesterday, can you help me with this?",42
5302,I was recently mugged and would like to know if I have to have access to the app to use your services and how I would go about setting up your services on a new device belonging to a current user?,42
5303,My phone is at the hotel.  How can I use the app?,42
5304,My cards were stolen,42
5305,My phone has been lost or stolen,42
5306,my phone has been stolen by someone,42
5307,What should I do if someone stole my phone?,42
5308,My phone has been stolen.  How can I make sure no one uses my account from it?,42
5309,Can I use your services without access to the app?,42
5310,I was mugged.  They took everything.  I can't use the app.  What do I do?,42
5311,How do I protect my phone from someone using it after I lost it.,42
5312,My phone was left behind.  Can I still use my card?,42
5313,phone is gone,42
5314,I just replaced my phone so do I have to make a new account?,42
5315,"Everything I have was stolen yesterday making it so I don't have access to the app, what should I do?",42
5316,I don't have my mobile device and am unable to make the payment because I forgot my details.,42
5317,What do I do if I lost my phone?,42
5318,I don't have my cell phone with me so I cannot access the system to complete the transaction.,42
5319,"I no longer have my phone, what should I do?",42
5320,I lost my phone and need help so someone doesn't access my account.,42
5321,Yesterday I had my phone stolen.  Please advise what I should do.,42
5322,I lost my phone and need help protecting it.,42
5323,I don't know where my phone is.,42
5324,I can't use the app because I got mugged yesterday and they took everything. I need some help.,42
5325,What should I do if my phone is lost or stolen?,42
5326,What do I do if I cannot access the app?,42
5327,I have lost my phone.,42
5328,what to do about stolen phone,42
5329,"I have lost my phone, what steps can I take to prevent someone using my account?",42
5330,Is there anything to do because my phone was stolen?,42
5331,Help!  I think my phone may be stolen or lost!,42
5332,"I no longer have my phone with the app, what should I do?",42
5333,Can I still access the app even though my phone was stolen?,42
5334,What do I do to lock my phone after losing it so my account isn't accessed,42
5335,I no longer have my phone.,42
5336,"I cannot get to my app, what should I do?",42
5337,Yesterday my phone was stolen from me :( What do i need to do about it?,42
5338,"My phone got stolen, how can I use the app?",42
5339,"My phone was stolen, what can I do?",42
5340,I accidentally left my phone at the hotel so now I'm not able to use the app.,42
5341,How can I access my account when I have lost my phone?,42
5342,I have lost my phone or it has been stolen.,42
5343,I can't find my phone; what can I do to prevent someone from accessing my account on it?,42
5344,What should I do if I lost my phone?,42
5345,My phone was left at a hotel and I can't access the app.,42
5346,"Hi, I lost my phone yesterday, what can I do to stop someone using my account on it?",42
5347,"I cannot find my phone, what should I do?",42
5348,My phone is missing.,42
5349,Do I need my phone to use the app?,42
5350,"left my phone at hotel, cant use app",42
5351,How do I use my card if I lost my phone?,42
5352,hello I have lost my phone and I'm worried someone's going to steal money from me,42
5353,"If I lost my phone, how can I stop someone from accessing my account through the app?",42
5354,"My phone was taken yesterday, is there something that I need to do?",42
5355,I can't use the app.  My phone is lost at the hotel.,42
5356,"If I lost my phone at the hotel, can I still use the app?",42
5357,I'm not sure where my phone is.  Can someone else use the app?,42
5358,"my phone was taken yesterday, what should I do about my account?",42
5359,"My phone is lost I don't want someone to use my account, what can I do?",42
5360,My phone has been stolen.,42
5361,I just replaced my phone but how do I use my card information?,42
5362,What do I do if my smart phone was stolen?,42
5363,How can I stop someone from using my card after I lost it yesterday.,42
5364,Do I need to do anything? My phone was stolen yesterday.,42
5365,Help!  What should I do?  My phone was stolen yesterday.,42
5366,I left my phone at the hotel.,42
5367,Everything was stolen from me.  I can't use the app.  Please advise.,42
5368,My things were stolen and I need to know if I can still use this app.,42
5369,"lost my phone, what is account security?",42
5370,I lost my phone.  What do I do to block someone else from using my account?,42
5371,"phone is at a hotel, can i still use app",42
5372,How long does it take to get a refund on something I bought?,52
5373,Please tell me how to get a refund for something I bought.,52
5374,Can i cancel this purchase?,52
5375,I want to return an item for a refund can I do that?,52
5376,Can I request a refund,52
5377,"I am not sure how this will work, but I have not received a product I ordered.  I want a refund, but should I just cancel the payment?",52
5378,Where do I go for a refund?,52
5379,I'm interested in learning more about product refunds.,52
5380,do you offer refunds? i would like to return purchase.,52
5381,What's the procedure for canceling a purchase?,52
5382,I need to cancel a purchase that I made the other day.,52
5383,Hello. How do i go about getting a refund of an item i bought ? I want to cancel the payment since i have not received the item yet.,52
5384,"I need a refund and cancel a transaction on an item I purchased and i need it as soon as possible, please!",52
5385,i bought the wrong size and would like a refund,52
5386,I want to know about your refund policy.,52
5387,Can I cancel an order if I haven't received the item yet? And how can I get my money back? Please help. Thanks.,52
5388,"Hey I want to get a refund on something I bought, but not sure how to go about it. Can you please just cancel the payment, I have not received the item yet.",52
5389,I am quite aggravated that I ordered online almost a month ago and I never got my package and I paid for it. I would really appreciate it if I could get a full refund back now.,52
5390,My statement has a charge that shouldn't have been made.,52
5391,My product hasn't arrived even though I ordered it a while ago. I want a refund!,52
5392,Is there a way you can have money from a purchase I made refunded to my account.,52
5393,I've changed my mind on an item.  How do I get a refund?,52
5394,"I decided I no long want something that I ordered, and want a refund. How do I go about doing that?",52
5395,How do I get a refund for something I bought?,52
5396,I made a purchase recently but I have decided that I'm not buying it and I need to receive my money back. Can you please give me a refund ASAP. It's extremely urgent.,52
5397,Please help me get a refund?,52
5398,What is the refund policy?,52
5399,I just bought an item and changed my mind.  I have not received it yet how can I get refunded.  Thank you.,52
5400,Are refunds allowed for certain items.,52
5401,I need to cancel a purchase?,52
5402,I have an incorrect charge and would like a refund.,52
5403,I want a refund on the things i bought,52
5404,I would like my money back for an item I purchased,52
5405,Please could you give me a refund,52
5406,"If I bought something I didn't like, can I get a refund?",52
5407,I bought something that I need a refund for.,52
5408,I want to cancel a purchase,52
5409,Am I able to get a refund for something I bought?,52
5410,"My order hasn't shown up yet, what can I do?",52
5411,My package is taking too long to arrive and I don't want it anymore. Can I get a refund?,52
5412,I would like to cancel my order.,52
5413,I want this fee reversed from my account.,52
5414,I want a refund,52
5415,I'd like to discuss an order I placed quite a long time ago. I have yet to receive it and am growing upset.  I want a refund as I now refuse to pay for the product.,52
5416,I ordered something online a while ago and I haven't gotten it. I would like a refund.,52
5417,"I received the wrong color and size, can I return it?",52
5418,Is it possible to get a refund?,52
5419,What's your refund policy if I bought an item from you?,52
5420,I want to cancel my purchase,52
5421,Can I get an item refunded?,52
5422,Please help! I need a refund on a transaction on something I bought and I need the refund right away!,52
5423,I purchased this item and would like a refund,52
5424,Hello I changed my mind and really need a refund on one of things I bought recently. Can you please cancel the transaction and get me my money back. Pls it's urgent,52
5425,How can I get a refund for an item I purchased but has not yet arrived?,52
5426,Can you please assist on my item that needs to be refunded?,52
5427,I didn't enjoy my tutor session and want a refund back. How do I go about doing this?,52
5428,I would like to cancel my previous purchase.,52
5429,Can you please refund my item?,52
5430,I made a purchase and would like to get a refund for what I bought can you have the money put back in my account?,52
5431,"Hey, I ordered a thing but changed my mind and want a refund on it. Since I haven't received the thing, would you just go ahead and cancel the payment for me?",52
5432,Can I have my money refunded for an item,52
5433,What do I need to do for a refund?,52
5434,I am interested in cancelling a purchase,52
5435,"It's been over a month and i still haven't received my goods! I ordered a pencil for crying out loud, it's not that hard to deliver that! I'm done with these people, give me a refund immediately! I'll search for my Japanese exclusive pencil elsewhere!",52
5436,How do I get my money back for something I bought?,52
5437,"Hi need your help for getting the refund or cancel the payment of an item, i have ordered but still have not received it.",52
5438,"I need your help to get a refund for an item I just bought, can you cancel the payment since what I bought hasn't arrived yet.",52
5439,How do I reverse a transaction on my account?,52
5440,Am I able to get a refund for a purchase?,52
5441,I need a refund for something I bought.,52
5442,I want a refund for my item,52
5443,Can I receive a refund for an item I purchased?,52
